{
  "site": {
    "name": "SalamTalk",
    "url": "https://salamtalk.com",
    "author": "SalamTalk",
    "twitterHandle": "@salamtalk",
    "defaultImage": "/og-image.png",
    "googleAnalyticsId": ""
  },
  "seo": {
    "metaTitle": "SalamTalk AI Pro | AI Business Phone System",
    "metaDescription": "SalamTalk AI Pro - 24/7 AI receptionist handles customer calls. Your team never misses opportunities. Smart routing, unified communications. Start free trial today.",
    "focusKeyword": "AI business phone system",
    "lsiKeywords": [
      "AI receptionist",
      "business phone system",
      "VoIP phone service",
      "cloud phone system",
      "virtual phone number",
      "call routing",
      "team collaboration",
      "unified communications",
      "AI call handling",
      "business communication",
      "24/7 call answering",
      "virtual receptionist",
      "phone system for small business",
      "cloud communications",
      "call management",
      "voicemail transcription",
      "business VoIP",
      "team messaging",
      "customer communication",
      "phone automation"
    ],
    "targetAudience": "Small to medium businesses, startups, and enterprises looking for an AI-powered business phone system with 24/7 availability and intelligent call routing.",
    "pageGoal": "MoFu",
    "pageStyle": "Benefit-Oriented + Problem/Solution",
    "competitorSentence": "Unlike traditional phone systems, SalamTalk AI Pro offers proactive AI intelligence that learns your business and automates customer communication."
  },
  "keywords": {
    "primary": [
      "AI business phone system",
      "AI receptionist",
      "customer calls",
      "team communication",
      "virtual phone system",
      "cloud phone system",
      "business VoIP",
      "call routing software",
      "24/7 call answering",
      "virtual receptionist",
      "business phone service",
      "unified communications",
      "call management system",
      "AI call handling",
      "business communication software"
    ],
    "secondary": [
      "VoIP phone service",
      "virtual phone number",
      "call forwarding",
      "voicemail transcription",
      "team messaging",
      "video conferencing",
      "CRM integration",
      "phone automation",
      "toll-free number",
      "business landline alternative",
      "remote work phone system",
      "customer communication tools",
      "inbound call center",
      "outbound calling",
      "SMS for business"
    ]
  },
  "sections": {
    "hero": {
      "h1": "Win Every Customer Moment with SalamTalk AI Pro",
      "subtitle": "The AI-powered phone system that brings calls, texts, and contacts together. Respond faster, capture every opportunity, and never lose revenue to a missed call.",
      "cta1": "Try for Free",
      "cta2": "Watch Demo",
      "containers": [
        {
          "id": 1,
          "title": "Unified Customer Context",
          "description": "All calls, texts, voicemails, and recordings in one place. See the complete customer history so your team always has full context.",
          "icon": "📞",
          "color": "from-blue-400 to-blue-600",
          "keywords": [
            "Unified Communication",
            "Customer Context",
            "Call History"
          ],
          "painPoint": "Say goodbye to scattered communication—everything's in one dashboard."
        },
        {
          "id": 2,
          "title": "Smart Proactive Intelligence",
          "description": "AI SMS Drafting and Smart Virtual Concierge that understands intent. Route calls perfectly, first time, every time.",
          "icon": "🤖",
          "color": "from-purple-400 to-purple-600",
          "keywords": [
            "Proactive Intelligence",
            "AI SMS Drafting",
            "Smart Routing"
          ],
          "painPoint": "Eliminate routing chaos with machines that learn your business."
        },
        {
          "id": 3,
          "title": "24/7 AI Receptionist (Sona)",
          "description": "Your AI agent answers calls when you're sleeping, picks up after-hours inquiries, qualifies leads. Always on. Always responsive.",
          "icon": "🌙",
          "color": "from-indigo-400 to-indigo-600",
          "keywords": [
            "24/7 Availability",
            "AI Receptionist",
            "Lead Qualification"
          ],
          "painPoint": "Never miss a customer—even at 2 AM on a Sunday."
        }
      ]
    },
    "h2_clarity": {
      "title": "Bring Order to Communication Chaos",
      "description": "Stop losing revenue to scattered conversations and missed context.",
      "h3_items": [
        {
          "heading": "One Dashboard for All Channels",
          "content": "Calls, texts, CRM, and contacts—unified so your team stops hunting across five different apps. Find any customer conversation instantly."
        },
        {
          "heading": "Shared Team Visibility",
          "content": "Your diverse customer base often highlights the need for seamless handoffs. SalamTalk lets your team see who's working on what and step in immediately when needed."
        },
        {
          "heading": "Automatic AI Organization",
          "content": "Note-taking, summaries, and AI-powered call tags work 24/7 so your team focuses on customers, not busywork."
        },
        {
          "heading": "Real-Time Collaboration",
          "content": "Share context behind the scenes, loop in the right teammate, and deliver faster responses. Customers notice responsiveness."
        }
      ]
    },
    "h2_speed": {
      "title": "Win Hearts with Your Responsiveness",
      "description": "Speed is a competitive advantage. SalamTalk AI Pro makes your team unstoppable.",
      "h3_items": [
        {
          "heading": "Shared Numbers for Instant Handoffs",
          "content": "Assign tasks, share context, route intelligently. No more 'wrong person' calls. Your team moves at customer speed."
        },
        {
          "heading": "24/7 AI Agent That Never Sleeps",
          "content": "Sona handles common questions, qualifies leads, and routes to humans when needed. Your business never stops responding."
        },
        {
          "heading": "Smart Integrations Across Your Stack",
          "content": "Syncs with HubSpot, Salesforce, Zapier, and Make so your calls, texts, and data stay perfectly in sync. Use our API for custom workflows too."
        },
        {
          "heading": "Proactive Workflow Automation",
          "content": "AI SMS Drafting, auto-summaries, and intelligent tagging mean your team spends zero time on admin."
        }
      ]
    },
    "h2_control": {
      "title": "Scale Your Business with Confidence",
      "description": "Custom workflows and intelligent oversight designed for growing teams.",
      "h3_items": [
        {
          "heading": "Phone Menu & Routing That Fits Your Flow",
          "content": "Set up call routing by team, schedule, or priority. Calls reach the right person every single time—automatically."
        },
        {
          "heading": "Build Custom Connections with Our API",
          "content": "Create integrations that fit your specific processes. SalamTalk AI Pro adapts to you, not the other way around."
        },
        {
          "heading": "Real-Time Analytics & Oversight",
          "content": "See what's working and what's not. Identify trouble spots early, leave feedback directly in SalamTalk, and guide your team to success."
        },
        {
          "heading": "Quick Team Performance Review",
          "content": "Track activity, trends, and conversion rates across teammates and numbers. Scale confidently knowing exactly what's happening."
        }
      ]
    },
    "h2_why_salamtalk": {
      "title": "Why 90,000+ Businesses Choose SalamTalk AI Pro",
      "description": "Enterprise-grade intelligence that pays for itself.",
      "items": [
        {
          "number": "350+",
          "label": "Hours Saved Weekly",
          "testimonial": "Save yourself the time, save yourself the hassle."
        },
        {
          "number": "3,000+",
          "label": "Hours Saved Monthly",
          "testimonial": "Scale with just six agents instead of hiring more staff."
        },
        {
          "number": "2x",
          "label": "Smoother Workflows",
          "testimonial": "Every after-hours call now gets handled with proactive intelligence."
        },
        {
          "number": "90K+",
          "label": "Active Businesses",
          "testimonial": "Trusted by growing SaaS companies, service businesses, and enterprises."
        }
      ]
    },
    "features": {
      "title": "Powerful Proactive Intelligence Built In",
      "description": "Every feature is designed to automate what slows you down and amplify what matters: customer relationships.",
      "h3_items": [
        {
          "heading": "AI SMS Drafting & Smart Replies",
          "description": "Respond faster with AI-suggested messages that match your tone. Save typing, keep quality high.",
          "keywords": "Proactive Intelligence, AI SMS, Smart Messaging"
        },
        {
          "heading": "Smart Virtual Concierge",
          "description": "Your first line of defense. Understands customer intent, answers FAQs, routes intelligently to the right team.",
          "keywords": "Virtual Concierge, Intelligent Routing, AI Support"
        },
        {
          "heading": "Proactive Workflow Automation",
          "description": "Automatic summaries, tag suggestions, and follow-up reminders. Your team's productivity multiplies without added headcount.",
          "keywords": "Workflow Automation, Auto-Tagging, Productivity"
        },
        {
          "heading": "24/7 Availability with Sona AI Agent",